{
  "scenario_id": "S1",
  "scenario_version": "draft-0.1",
  "implementation": {
    "repository": "https://github.com/halvrenofviryel/phionyx-mcp-server",
    "commit": "2fd258e7afcd9e1a5c092a74edb663808835af5d",
    "package_versions": {
      "phionyx-mcp-server": "0.2.1"
    }
  },
  "decision_outcome": "DEFER",
  "measurement_status": "FAIL",
  "enforcement_status": "NOT_REQUIRED",
  "evidence_status": "E0",
  "executed_at": "2026-08-17T19:03:04+00:00",
  "command": "python scenarios/S1_unauthorized_tool_action/run.py",
  "exit_code": 1,
  "assertions": [
    {
      "name": "S1-A1-policy-evaluator-executed",
      "status": "PASS",
      "note": "the authority/policy evaluator executes and returns a result | expected: a structured comparison result is produced | observed: result keys=['baseline_exists', 'baseline_hash', 'change_detected', 'current_hash']"
    },
    {
      "name": "S1-A2-tool-invocation-not-observed",
      "status": "PASS",
      "note": "the authority check must not itself invoke/commit the tool call | expected: the evaluator has no parameter or output through which a tool could be invoked | observed: invocation-capable params=none; invocation output fields=none; signature params=['baseline_hash', 'current_hash']"
    },
    {
      "name": "S1-A3-enforcement-status-is-APPLIED",
      "status": "FAIL",
      "note": "on missing authority, enforcement (DENY/STEP_UP) is APPLIED | expected: the result carries a decision/enforcement field that denies or steps up | observed: decision-like fields present=none; denotes DENY/STEP_UP=False"
    },
    {
      "name": "S1-A4-missing-authority-is-not-treated-as-allow",
      "status": "PASS",
      "note": "no prior approval must not read the same as an approved, matching descriptor | expected: the no-approval return is distinguishable from approved-match (a signal a consumer can act on) | observed: distinguishing fields=['baseline_exists', 'baseline_hash']; primary change verdict collides (change_detected False vs False)=True -> the distinction lives only in baseline_exists, which the surface exposes but does not enforce (see A3)"
    }
  ],
  "source_artifacts": [
    {
      "path_or_uri": "https://files.pythonhosted.org/packages/f8/3e/8eca30e18432eca3683c678e946d47ad603abd08e597ab57c013f3466b36/phionyx_mcp_server-0.2.1-py3-none-any.whl",
      "sha256": "4d29b9a0b9ec87882daae125d827bd799ca43bee4d86d00b481f2cc554b7bd51",
      "resolvable": true
    }
  ],
  "independent_rerun": {
    "status": "NOT_REQUESTED"
  },
  "limitations": [
    "in-process surface: drives descriptor_hash directly, not a running MCP host round-trip",
    "the comparator is advisory by design; A4 confirms it exposes the correct distinguishing signal (baseline_exists=False), while A3 measures that no enforcement (DENY/STEP_UP) is applied to that signal \u2014 the gap is enforcement wiring, not a wrong hash",
    "the distinction lives only in baseline_exists; a consumer gating on change_detected alone would misread missing authority as unchanged \u2014 a consumer defect this surface enables",
    "capability_scope, policy_version and state_version (named in the scenario spec required_inputs) are not consumed by this comparator; the check is descriptor-hash only",
    "the installed distribution's binding to IMPL_COMMIT is not attested by the artifact itself"
  ]
}
